{
  "schema_version": "remora-interop-result-v1",
  "contract_id": "exact-call-binding-v1.1",
  "edge": "E-ECB-V1-1",
  "claim": "single_use_authorization",
  "subject": "execution_authorization:remora-execution-lease",
  "status": "ESTABLISHED",
  "producer": {
    "project": "REMORA",
    "repository": "darklordVirtual/REMORA-research",
    "revision": "537a1a123932bf93bb2a28786ce67d426d671739"
  },
  "consumer": {
    "project": "REMORA",
    "repository": "darklordVirtual/REMORA-research",
    "revision": "537a1a123932bf93bb2a28786ce67d426d671739"
  },
  "fixture": {
    "path": "artifacts/interop/exact-call-binding-v1.1/fixtures.json",
    "digest": "sha256:eb1abc071fca08bbac6ba723f1878cfa5aa3ea806f956c2fd3a2119f621357c8",
    "package_digest": "sha256:85fc94d92fbc1b4937409b0f1e40cde248e8c2f92fb68febfa0a0bc2fa146380"
  },
  "evaluator": {
    "project": "REMORA",
    "repository": "darklordVirtual/REMORA-research",
    "revision": "537a1a123932bf93bb2a28786ce67d426d671739",
    "kind": "PRODUCER_RUNTIME",
    "maintained_by": "PRODUCER",
    "imports_producer_runtime": true,
    "imports_reference_evaluator": false,
    "command": "python scripts/interop_author_run.py --write  # remora/interop/boundary_fixtures.py"
  },
  "operator": "PRODUCER",
  "host": "PRODUCER_CONTROLLED",
  "independence_level": "L0_SELF_TEST",
  "runner": {
    "path": "scripts/interop_author_run.py",
    "revision": "537a1a123932bf93bb2a28786ce67d426d671739"
  },
  "environment": "Python 3.14.0, Windows AMD64",
  "started_at": "2026-10-05T23:46:35+00:00",
  "completed_at": "2026-10-05T23:46:35+00:00",
  "cases": [
    {
      "case_id": "replay_same_call_twice",
      "claim_id": "single_use_authorization",
      "expected": {
        "value": [
          {
            "outcome": "DISPATCHED",
            "refusal_class": null
          },
          {
            "outcome": "REFUSED",
            "refusal_class": "authority_consumed"
          }
        ]
      },
      "observed": {
        "value": [
          {
            "outcome": "DISPATCHED",
            "refusal_class": null
          },
          {
            "outcome": "REFUSED",
            "refusal_class": "authority_consumed"
          }
        ]
      },
      "result": "ESTABLISHED"
    },
    {
      "case_id": "mismatch_does_not_consume",
      "claim_id": "single_use_authorization",
      "expected": {
        "value": [
          {
            "outcome": "REFUSED",
            "refusal_class": "call_mismatch"
          },
          {
            "outcome": "DISPATCHED",
            "refusal_class": null
          }
        ]
      },
      "observed": {
        "value": [
          {
            "outcome": "REFUSED",
            "refusal_class": "call_mismatch"
          },
          {
            "outcome": "DISPATCHED",
            "refusal_class": null
          }
        ]
      },
      "result": "ESTABLISHED"
    }
  ],
  "establishes": [
    "single_use_authorization: ESTABLISHED means only that, under this fixture contract, one authorization dispatches at most once and a refused mismatch does not spend it."
  ],
  "does_not_establish": [
    "correct semantic intent of the authorized call",
    "that an external effect occurred",
    "that every path to the tool passes through the enforcement point",
    "a prescribed hash algorithm or wire format for the binding",
    "production deployment safety",
    "Federation endorsement",
    "a second implementation is by itself an independent verification record",
    "that a call object mutated after the binding check and before the tool reads it is refused (verify-then-mutate, TOCTOU); a static corpus cannot express post-verification mutation"
  ],
  "ceiling": {
    "implies_endorsement": false,
    "implies_production_safety": false,
    "implies_broader_validity": false,
    "confers_authority": false
  },
  "run_ref": "artifacts/interop/runs/exact-call-binding-v1.1-single_use_authorization-author-runtime-L0.json",
  "published_at": null
}
