{
  "schema_version": "remora-interop-result-v1",
  "contract_id": "effect-evidence-v2",
  "edge": "E-EE-V2",
  "claim": "effect_call_binding",
  "subject": "effect_verification:remora-effect-verification",
  "status": "ESTABLISHED",
  "producer": {
    "project": "REMORA",
    "repository": "darklordVirtual/REMORA-research",
    "revision": "5b2c7dc8d50f35c962711fcb882308189ccdd52a"
  },
  "consumer": {
    "project": "REMORA",
    "repository": "darklordVirtual/REMORA-research",
    "revision": "5b2c7dc8d50f35c962711fcb882308189ccdd52a"
  },
  "fixture": {
    "path": "artifacts/interop/effect-evidence-v2/fixtures.json",
    "digest": "sha256:a88b53c2e771103828d8d6f13080062a175affe92ff12be9d9552b24587047f7",
    "package_digest": "sha256:536413e60e11ed909d3275a2d5c6b60c3f73ee0b34612d5b1ead1851a83be5d5"
  },
  "evaluator": {
    "project": "REMORA",
    "repository": "darklordVirtual/REMORA-research",
    "revision": "5b2c7dc8d50f35c962711fcb882308189ccdd52a",
    "kind": "REFERENCE",
    "maintained_by": "PRODUCER",
    "imports_producer_runtime": false,
    "imports_reference_evaluator": true,
    "command": "python artifacts/interop/effect-evidence-v2/reference_verifier.py"
  },
  "operator": "PRODUCER",
  "host": "PRODUCER_CONTROLLED",
  "independence_level": "L0_SELF_TEST",
  "runner": {
    "path": "scripts/interop_author_run.py",
    "revision": "5b2c7dc8d50f35c962711fcb882308189ccdd52a"
  },
  "environment": "Python 3.13.7, Darwin arm64",
  "started_at": "2026-10-18T21:51:45+00:00",
  "completed_at": "2026-10-18T21:51:45+00:00",
  "cases": [
    {
      "case_id": "bundle_for_other_call",
      "claim_id": "effect_call_binding",
      "expected": {
        "value": {
          "effect_status": "NOT_EVALUATED",
          "highest_established_state": "NOT_DISPATCHED",
          "lineage_status": "tool_call_hash_mismatch",
          "vantage": "NOT_EVALUATED"
        }
      },
      "observed": {
        "value": {
          "effect_status": "NOT_EVALUATED",
          "highest_established_state": "NOT_DISPATCHED",
          "lineage_status": "tool_call_hash_mismatch",
          "vantage": "NOT_EVALUATED"
        }
      },
      "result": "ESTABLISHED"
    },
    {
      "case_id": "bundle_for_other_call_reports_failure",
      "claim_id": "effect_call_binding",
      "expected": {
        "value": {
          "effect_status": "NOT_EVALUATED",
          "highest_established_state": "NOT_DISPATCHED",
          "lineage_status": "tool_call_hash_mismatch",
          "vantage": "NOT_EVALUATED"
        }
      },
      "observed": {
        "value": {
          "effect_status": "NOT_EVALUATED",
          "highest_established_state": "NOT_DISPATCHED",
          "lineage_status": "tool_call_hash_mismatch",
          "vantage": "NOT_EVALUATED"
        }
      },
      "result": "ESTABLISHED"
    },
    {
      "case_id": "bundle_call_differs_in_case",
      "claim_id": "effect_call_binding",
      "expected": {
        "value": {
          "effect_status": "NOT_EVALUATED",
          "highest_established_state": "NOT_DISPATCHED",
          "lineage_status": "tool_call_hash_mismatch",
          "vantage": "NOT_EVALUATED"
        }
      },
      "observed": {
        "value": {
          "effect_status": "NOT_EVALUATED",
          "highest_established_state": "NOT_DISPATCHED",
          "lineage_status": "tool_call_hash_mismatch",
          "vantage": "NOT_EVALUATED"
        }
      },
      "result": "ESTABLISHED"
    }
  ],
  "establishes": [
    "effect_call_binding: ESTABLISHED means only that, under this fixture contract, a bundle whose call binding is not the invocation, compared as exact strings, is refused as tool_call_hash_mismatch and leaves the invocation at NOT_DISPATCHED. It does not establish that the binding digest was computed over the call that ran."
  ],
  "does_not_establish": [
    "that the capture is authentic or complete",
    "that the declared control domains and credentials are true of a deployment",
    "that no effect outside the declared delta occurred",
    "causation of an observed effect",
    "production deployment safety",
    "Federation endorsement",
    "a second implementation is by itself an independent verification record"
  ],
  "ceiling": {
    "implies_endorsement": false,
    "implies_production_safety": false,
    "implies_broader_validity": false,
    "confers_authority": false
  },
  "run_ref": "artifacts/interop/runs/effect-evidence-v2-effect_call_binding-author-reference-L0.json",
  "published_at": null
}
